Pinterest ID,Name,Description,Alt Text,URL
442619469669547033,"Walnut Lounge Chairs attributed to Adrian Pearsall for for Craft Associates, 1960, Set of 2","Pair of armchairs designed by the American designer Adrian Pearsall. The structure of these lounge cocktail armchairs is made of walnut wood with a beautiful curved shape and covered in long-haired Bouclè fabric in a light ivory colour. The armchairs have been restored and reupholstered. This piece is attributed to the mentioned designer/maker. It has no attribution mark and no official proof of authenticity, however it is well documented in design history. I take full responsibility for any",a wooden chair with white upholstered cushions,https://i.pinimg.com/736x/e3/fd/69/e3fd697514de07578d5e3d2b1ca51d79.jpg
48061921664344920,"Ivy Bronx Nabil, Solid Wood in Black;white | 1 | Wayfair Living Room Sets","Cream wabi-Sabi lamb cashmere lazy sofa chair Bedroom floor single solid wood leisure chair Ivy Bronx | Ivy Bronx Nabil, Solid Wood in Black;white | 1 | Wayfair Living Room Sets",a white chair sitting next to a table with a black vase on top of it,https://i.pinimg.com/736x/e5/fd/7e/e5fd7efee4a11c04ae822e29bb8ec823.jpg
869546640552591945,Rowanoke Dining Armchair - City Grey,"Inspired by Danish midcentury styles, this dining armchair pairs angular framework with soft, rounded seat panels. Seating and arm straps finished in a cotton performance fabric. Performance fabrics are specially created to withstand spills, stains, high traffic and wear, ensuring long-term comfort and unmatched durability.",a black chair sitting in front of a wooden table,https://i.pinimg.com/736x/9f/f5/bb/9ff5bb96c8864dd457029065817a8171.jpg
97108935742888559,Lounge Chair Bun By Woo,"BUN Lounge Chair – A Playful Fusion of Design and Comfort What if furniture could be as soft and inviting as freshly baked pastries—ravioli, homemade pasta, or buttery croissants? Inspired by a cooking TV show, designer Dmitry Kozinenko envisioned the BUN lounge chair, transforming culinary artistry into a unique furniture concept. The chair’s puffy, rounded forms resemble an appetizing bun straight from the display case of your favorite patisserie, bringing a sense of warmth and comfort to any","BUN Lounge Chair – A Playful Fusion of Design and Comfort What if furniture could be as soft and inviting as freshly baked pastries—ravioli, homemade pasta, or buttery croissants? Inspired by a cooking TV show, designer Dmitry Kozinenko envisioned the BUN lounge chair, transforming culinary artistry into a unique furniture concept. The chair’s puffy, rounded forms resemble an appetizing bun straight from the display case of your favorite patisserie, bringing a sense of warmth and comfort to any",https://i.pinimg.com/736x/48/0e/c2/480ec22e6a60ca662d57cb24f468cedb.jpg
279715826843231227,Chieftains Chair – Design Within Reach,"Finn Juhl created a chair for the 1949 Cabinetmakers’ Guild in Copenhagen. During the exhibition, King Frederick IX sat in the chair, causing a journalist to suggest calling it the “King’s Chair.” But Juhl resisted and said, “You had better call it a chieftain’s chair,” which the journalist did. (At some point the apostrophe was dropped.) This is the authentic Chieftains Chair (1949) by Onecollection. Made in Denmark. | Chieftains Chair, Black at Design Within Reach",a black leather chair sitting in front of a wall,https://i.pinimg.com/736x/9f/92/2c/9f922c7d158ce15a85f0d37b5b25c1cc.jpg
448178600435565496,"Uplift Guest Chair: Considered, Elegant, Unique","Uplift, designed by Alyssa Coletti, is an accent piece that truly defines the meaning of “guest"" chair.",two chairs sitting next to each other in front of curtains,https://i.pinimg.com/736x/1e/42/41/1e4241a2b8e6d14a90ad442980484653.jpg
258675572341618075,Curva Lounge Chair,"Relax and unwind with the Curva Lounge Chair. Crafted from natural rattan and accented with brushed brass details, this chair reimagines our beloved Mia Lounge Chair with a modern twist, making it perfect for both indoor and outdoor use. Wherever you place the Curva, it creates a high-impact design moment worthy of conversation.",a green and brown chair sitting on top of a tan floor next to a wall,https://i.pinimg.com/736x/a5/cb/68/a5cb6883fd0c3a98f0448632f8c5c402.jpg
39828777961083086,Rhea Chair,"Refresh your reading nooks and seating areas with this cushioned chair. Upholstered allover in printed polyester fabric, this chair features a circular structure with a cushioned seat and backrest that wraps around the front to form a cozy arm rest for additional support. Finished with clean, curving lines and a swivel base so you can rotate to the right position. Available exclusively at Urban Outfitters. Features - Modern arm chair from our Rhea furniture collection - Upholstered in printed polyester fabric - Cushioned seat and back - Rotating base - Arrives fully assembled - UO exclusive Content + Care - Arrives fully assembled - Polyester fabric, eucalyptus, foam, iron - Spot clean - Imported Size - Dimensions: 30""l x 27.6""w x 34.65""h - Leg height/Clearance: 1"" - Seat height: 17.7"" - Interior seat dimensions: 25""l x 21.65""w x 17.7""h - Weight: 55 lbs - Shipping package dimensions: 30.5""l x 28""w x 35""h - Shipping package weight: 60.5 lbs",a blue and green striped chair sitting on top of a cement floor next to a white wall,https://i.pinimg.com/736x/d3/12/e0/d312e0a252cf8c01968bf1de3e4267f5.jpg
4611475023986089984,Brown Yellow Armrest Chairs Fabric Support Luxury Balcony Design Rocking Chair Lounge Comfy Single,Brown Yellow Armrest Chairs Fabric Support Luxury Balcony Design Rocking Chair Lounge Comfy Single,a white chair sitting on top of a wooden floor,https://i.pinimg.com/736x/ab/b4/60/abb4608a9a858a9b2850021544fdb82b.jpg
413909022018467762,Erin Fetherston Dulcette Swivel Chair,"Style No. 83319194; Color Code: 054 Upholstered in the softest velvet and set on a ridged wooden base, the Dulcette chair offers a modern spin on a classic silhouette. Lend ultra-elegant charm to your interior with the Dulcette collection, designed exclusively for Anthropologie by Erin Fetherston. Characterized by warm textures, minimalist aesthetics, and thoughtful shapes, this collection offers stylish pieces you’re sure to cherish for years to come. For ordering assistance and more, please contact us. For aesthetic advice and tips to help decorate your space, enjoy our complimentary home styling services. For more information on the materials and techniques of this piece, click here. Exclusively for Anthropologie Velvet upholstery: 100% polyester Cushion content: Feather blend Spring seat construction One seat cushion One back cushion Cushions are removable Kiln-dried hardwood frame Ash wood base Professionally clean This piece is intended for indoor use No assembly required Imported Erin Fetherston Based in Los Angeles, Erin Fetherston is a fashion designer turned interior designer who believes good design should work hand-in-hand with lifestyle. Her interiors, while modern, exude warmth and reflect a connection to nature, cultivating bright and airy spaces with family-friendly know-how.","a living room with a chair, table and vase",https://i.pinimg.com/736x/db/89/18/db89182ae9701d0ed35364d2d0b8bf74.jpg
273804852339678706,PI Chair,"A remix of a traditional circular lounge chair, this oval beauty presents a flared back of padded fins. Upholstered in the customer’s own material, tailoring sees every seam matched. Welting detail can be specified to match the crisp lines. The elliptical back in beautifully finished white oak additionally forms the base.*All seating designs can be produced in custom finishes, fabrics & leathers. Upon receiving customer's own materials (COM/COL), production lead time is 10 weeks. *Trade Discount Available SHOWN IN Teal Woven Wool & Cotton Jacquard Welt - 100% Wool Satin, Teal PRODUCT SPECIFICATIONS Height: 31""Width: 34""Depth: 26.5""Seat Height: 19""Seat Depth: 23""Arm Height: 23.5"" DOWNLOADS PI Chair SHIPPING Please note delivery is not included. A representative will reach out to arrange shipping.",four different views of a couch and chair with the same fabric material as it appears to be woven,https://i.pinimg.com/736x/9d/84/a8/9d84a857195f169e740c7a06302290c8.jpg
757097387395058035,Known Work — the Furniture Spinoff of Interiors Studio Parts and Labor Design — Just Launched an Immediately Iconic Debut Collection - Sight Unseen,"Parts and Labor Design, the NYC interiors studio noted for its atmospheric hospitality projects, launched Known Work and its first collection last month.",an unusual wooden chair sitting on top of a white floor next to a beige wall,https://i.pinimg.com/736x/b2/e3/0f/b2e30f632957c8bf80cb574549f1874c.jpg
442619469679882476,"Mid-Century Bauhaus Lounge Chair in Black Leather, 1980s","Mid century Bauhaus Scorpion chaise lounge chair black leather Italy 1980s Scorpion is perfect for an open space with a minimalist interior design of a house or apartment. Also, the Lounger will perfectly save space in the house. Dimensions Total height 97 cm Total width 71 cm Total depth 140 cm Seat height 33 cm Seat width 60 cm",a chair made out of wood and metal,https://i.pinimg.com/736x/57/ca/fc/57cafcd96abab6f42218128b6c432b20.jpg
123919427243823766,Saddle Leather Accent Chair,"Our Saddle accent chair is the perfect blend of nostalgia and modern design. Exuding a cool 1970s vibe with its lived-in warm cognac leather, the chair is inspired by emerging fashion trends with woven textures seen in high-end accessories. Wrapped on a burnished brass frame, wide strips of brown saddle leather are woven to create a continuous flow over the cantilevered frame. Anchor your modern decor with this striking slipper chair, only available at Crate & Barrel. Woven leather…",a brown chair sitting on top of a rug next to a table with a vase in it,https://i.pinimg.com/736x/94/99/ae/9499ae708b562c06d83bb15c17a11ce1.jpg
415175659419304291,Chassis Black Ash Solid Wood Armchair and Orange Fabric Upholstery,"Elegantly crafted from robust Black Ash wood and featuring a luxurious seat adorned in vibrant dark orange fabric, this distinguished armchair marries iconic design with meticulous craftsmanship. Its slender armrests and the open space beneath impart a sense of lightness and sophistication, elevating its timeless allure. With customizable wood finishes and upholstery in fabric or leather, this piece embodies versatility and sophistication, complementing any decor or personal style.","an orange chair with black legs and arms on white background, it is designed to look like a bent armrest",https://i.pinimg.com/736x/8d/5c/d1/8d5cd1d876f68313caf21d2248d2b1e7.jpg
97108935742524351,"Angelo Mangiarotti Lounge Chair - & Chiara Pampo Légère Italian Post-Modern Leather, Ash","Angelo Mangiarotti e Chiara Pampo for Rosenthal, 'Légère' lounge chair, lacquered ash, leather, Italy, 1978 Sturdy lounge chair designed by Angelo Mangiarotti and Chiara Pampo and manufactured by Rosenthal. The easy chair features a sturdy curved, frame executed in black lacquered ash that holds the tufted, black leather cushions in a graceful manner. The piece has smooth rounded lines that are visible in the legs and the curved armrests. A great combination of comfort and elegance. This lounge",a black leather recliner chair with footstool and armrests on an isolated white background,https://i.pinimg.com/736x/af/9e/e1/af9ee1c634e8973b7fee77402a04780b.jpg
386042999326936744,Malta Chair In Piermont Oyster,"Sculptural rounded cushioning softens the linear, asymmetrical frame of this statement seating. Solid ash frame with cream-hued performance upholstery. Performance fabrics are specially created to withstand spills, stains, high traffic and wear, ensuring long-term comfort and unmatched durability.",a white chair sitting on top of a rug next to a wooden cabinet and vase,https://i.pinimg.com/736x/00/fe/d6/00fed665846cdf393b794f261e55ea90.jpg
48061921643847936,"HarmonyFurns Simple solid wood ash wood chair brown/Wood in Off-White | 33.85"" H X 29.92"" W X 62.99"" L | Wayfair","A chair made entirely of ash wood, without any auxiliary wood. It has a mortise and tenon structure and a fan mortise and tenon joint for enhanced stability. High elastic sponges provide comfort.. Finished with healthy, odorless, environmentally friendly paint. The perfect combination of fashion and durability. HarmonyFurns | HarmonyFurns Simple solid wood ash wood chair brownPolyester / Wood in Off-White | 33.85"" H X 29.92"" W X 62.99"" L | Wayfair",a white and brown chair sitting on top of a hard wood floor next to a wall,https://i.pinimg.com/736x/b2/09/ac/b209ac936ef87249f2700f628eeba5d6.jpg
593490057163509590,Alexandre Caldas Designs Portuguese Roots Lounge Chair for AROUNDtheTREE,"The Portuguese Roots Lounge Chair is one of their finest chairs. Designed by Alexandre Caldas, it is a minimalist upholstered wood chair embodying a deep sense of Scandinavian design and style.",two different angles of a wooden chair with blue fabric on the seat and back side,https://i.pinimg.com/736x/f6/20/e8/f620e82e2644b08aa0575d92c0c20acb.jpg
606508274847876596,Bell Chair by Studio Sam Klemick [Custom Order] - WITH CUSHION,"Bell Chair by Studio Sam Klemick Available in custom upholstery and stain options. Please email sales@claudehome.com for further information. Materials: bleached oak, canvas - custom finish + upholstery available Measurements: 29.5” H x 28.5” D x 28” W Seat Height: 15.5” Price with cushion: $5,400 Price without cushion: $5,700 Item is made to order Estimated production time: 3-4 weeks after fabric is received. Shipping not included in price, please email Sales@claudehome.com for a quote",a chair that is sitting on some kind of tile floor with a black and red cushion,https://i.pinimg.com/736x/2d/df/5b/2ddf5b64e768bed523461f33af3660da.jpg
24277285505577049,Haverhill Rocking Chair,"Reminiscent of Danish midcentury designs, this modern rocker features a wide- set silhouette with tufted cushions upholstered in natural oatmeal linen. For ordering assistance and more, please contact us. For aesthetic advice and tips to help decorate your space, enjoy our complimentary home styling services. | Haverhill Rocking Chair by Anthropologie in Brown, Linen",a wooden rocking chair sitting on top of a white floor,https://i.pinimg.com/736x/13/85/10/138510071dbe749e92bf457b8cb010ad.jpg
1064749537285674905,Glass Nouvel Pendant Lamp Dia 20 cm x H 46 cm / ∅ 7.8″ x H 18.1″-Gold and Black,"The Glass Nouvel Pendant Lamp is a striking addition to any space. Its combination of polished brass, polished gold and black, and white glass balls creates a bold and modern aesthetic. With its simple yet elegant design, this double pendant lamp is the perfect way to add a touch of sophistication to your home or office. Adds a striking touch of elegance to any space. Please note: Your payment does not include customs duties, local taxes, or any other import costs. If you have any questions about our products, please contact us and we will get back to you within 24 hours. Product Size Size : Dia 20 cm x H 46 cm / ∅ 7.8″ x H 18.1″ Details Materials: Metal, Glass Light source: LED bulb or Edison bulb Light source base type: G9 (as shown below) Power: 5W Voltage: AC 11",a blue chair sitting in front of a gray wall,https://i.pinimg.com/736x/52/b8/12/52b8128d57087ecf0d442b9b5cd87446.jpg
442619469678106137,Rocking Armchair by Luigi Crassewig,"Rocking Armchair by Luigi Crassewig, in Good conditions. Designed 1960 to 1969 This piece has an attribution mark, I am sure that it is completely authentic and take full responsibility for any authenticity issues arising from misattribution",a white rocking chair sitting on top of a cement floor,https://i.pinimg.com/736x/a8/2c/72/a82c726104309a4f34b229f73aeb2b8d.jpg
474707616990323510,Furniture Collage,,an upholstered chair with a wooden frame and foot rest in front of a gray wall,https://i.pinimg.com/736x/43/82/15/43821525ccf80ca41c6936d23cc8a82f.jpg
1125968697954901,"Side Chair - Everly Quinn Anari 29.52"" Wide Side Chair 30.31 H x 29.52 W x 37.4 D in brown | 30.31"" H X 29.52"" W X 37.40"" D | Wayfair","Fashionable soft bag texture sofa chairs, this set includes two, with a modern and retro simple color scheme, lazy and casual, and a novel style design. Sitting on it, whether reading, chatting, or working, it exudes a leisurely atmosphere, suitable for various scenarios Everly Quinn Fabric OR Leather Type: Green Microfiber/Microsuede | Side Chair - Everly Quinn Anari 29.52"" Wide Side Chair 30.31 H x 29.52 W x 37.4 D in brown | 30.31"" H X 29.52"" W X 37.40"" D | Wayfair",pair of green velvet lounge chairs,https://i.pinimg.com/736x/0b/ef/06/0bef069fcd196d1f1f56a2e0b8430eb1.jpg
394065036164069939,Sahrai Ottoman,"The Sahrai collection draws inspiration from the iconic director's chair, reinterpreting its signature ""X"" shape by flipping it horizontally to form the striking base of this seats. The rest is down to the Leather details, the padding and the metallic finishes which breathe life into these incredibly refined seat. This high-end ottoman is designed as the perfect complement to the lounge chair from the same collection. Made in Italy.",a chair and ottoman sitting next to each other on a white floor with an empty wall in the background,https://i.pinimg.com/736x/5d/ee/d8/5deed88967fab307cb2fcad56e6776d0.jpg
832462312397812220,Sleek Recliner Chair - White,"Spark up your seating game Are you tired of lounging on a boring, outdated recliner? Say goodbye to your lumpy old cushion and hello to the sleek and stylish electric reclining chair of your dreams. With this bad boy in your living room, you'll be sitting pretty - and with the touch of a button, you can elevate your seating game to the next level. Smart meets comfort Get ready to experience a royal level of relaxation with this reclining chair that's smoother than butter on a hot pan. With HD Fo",a green recliner chair sitting on top of a white rug in a living room,https://i.pinimg.com/736x/30/09/77/300977dba3c9c274d33ca5c41726af1b.jpg
946881890415142956,"Mario Marenco ""Sapporo"" Chairs for Mobil Girgi, 1970, Set of 8","Mario Marenco ""Sapporo"" chairs for Mobil Girgi, reddish-brown leather and beech, Italy, 1970, set of eight. The iconic ""Sapporo"" chair consists of a particular backrest, conceived with two vertical slats slightly separated. The immediate impact of this chair is strong: the sculptural backrest is connected with the flat front legs, creating a charming combination. With a style close to the iconic ""Africa"" chairs by Afra & Tobia Scarpa, the Italian beechwood combined with the reddish-brown leather seat gives the chair a sense of class and elegance. Internationally known as an architect and designer, few people know that Mario Marenco (1993-2019) has been primarily a great Italian actor. He used to work in collaboration with some of the best manufacturers of the period, such as Poltrona Frau, Artemide, and Arflex. Our atelier carefully restored the chairs. Slight signs of use and time.",a wooden chair sitting on top of a cement floor next to a white wall in an empty room,https://i.pinimg.com/736x/22/62/4f/22624f45248799b71746b6e5d9f07b50.jpg
415175659421175025,Shibari White Fabric Lounge Chair in 2025,"The Shibari chair, designed by Studiopepe, exudes understated elegance with its upholstery in premium Paddington Chalk fabric. Combining timeless design and luxurious comfort, it’s the perfect statement piece for sophisticated interiors.",a chair made out of sheep's wool with two arms and legs in the shape of an elephant,https://i.pinimg.com/736x/74/40/21/744021f26b37a228372024281f69313f.jpg
48061921662134216,"wangling hone Modern eco-friendly chair in Red | 33.46"" H X 25.98"" W X 62.99"" L | Wayfair","This stylish chair was designed with environmental awareness in mind. Its frame is made of durable resin material, ensuring stability while being environmentally friendly. Stainless steel base provides reliable support. The interior sponge padding ensures comfort. wangling hone Upholstery Color: Red | wangling hone Modern eco-friendly chair Polyester in Red | 33.46"" H X 25.98"" W X 62.99"" L | Wayfair",a living room scene with focus on the red chair and white area rug that matches the wooden paneled wall,https://i.pinimg.com/736x/29/c4/22/29c42218b2ef88d1a1c8f2c2ea12c8db.jpg
97108935732207635,C&b Italia Lounge Chair - Early Mario Bellini Le Bambole 1970S Italian Mid-Century Modern Leather,"A rare first edition Mario Bellini Le Bambole lounge chair, in its original wonderfully patinated leather, produced by C&B Italia, Italy, in the early 1970s. Fast shipping worldwide.",a brown leather bean bag chair sitting on top of a white floor,https://i.pinimg.com/736x/d8/f2/68/d8f268d4cfdad10bf0a34ee6ec8fd9c5.jpg
24277285505114801,Bouclé Gemma Chair,"Crafted from textured bouclé, this occasional chair pairs elegant design with modern simplicity. With its curved, sculptural silhouette and inviting air, it effortlessly elevates a living space or head of the dining table. For ordering assistance and more, please contact us For aesthetic advice and tips to help decorate your space, enjoy our complimentary home styling services | Bouclé Gemma Chair by Anthropologie in White, Polyester/Acrylic",a white chair sitting on top of a white floor,https://i.pinimg.com/736x/7f/5d/2d/7f5d2d1980a2b2ec67434776da249807.jpg
2462974782868545,Il Bauhaus e i mobili di design. - Questioni di Arredamento,"Uno dei principali obiettivi del Bauhaus fu il processo di qualificazione del prodotto industriale unendo arte, artigianato e industria.",a group of chairs sitting next to each other,https://i.pinimg.com/736x/2a/58/80/2a58802ba5b160ea6e3a2800e2101fb9.jpg
442619469678780333,Large Scale 1970s Leather Lounge Chair,Large-scale 1970s leather lounge chair. Exceptional quality and comfort. Original leather is nicely worn with great patina.,a brown leather chair sitting on top of a white background,https://i.pinimg.com/736x/62/99/f1/6299f1627dd427b7a79f6442fb7bdc99.jpg
1110137376900336852,Abstract Chair,,a green chair sitting on top of a wooden table,https://i.pinimg.com/736x/21/21/33/212133adb12a82bdf7dc690ac7901236.jpg
1125968687328004,"Wrought Studio™ Bertin 31"" Upholstered Single Swivel Sofa brown in Yellow | Wayfair","The 31"" Upholstered Single Swivel Sofa is designed to bring a modern, stylish flair to any living space. This single-seat sofa is perfect for adding a touch of sophistication and comfort to your home. Its compact design is ideal for smaller spaces, such as apartments, home offices, or cozy corners in your living room. The swivel function adds versatility, making it a practical choice for dynamic, multi-functional spaces. Wrought Studio™ Upholstery Color: Yellow | Wrought Studio™ Bertin 31"" Uphol",a brown chair sitting on top of a metal base,https://i.pinimg.com/736x/5a/82/3c/5a823c2cd9cfd0786b09928b934f9601.jpg
777082110721516363,Baffo Groupo Leather Chair,"""Baffo"" chair by Busnelli. Designed by Gianni Pareschi and Ezio Didone in 1969. Chrome polished metal and black stitched leather. This chair is from the original edition, not the 2007 reissue.",a hammock chair sitting on top of a metal stand in a living room,https://i.pinimg.com/736x/2d/78/3c/2d783c22cde199660040aa46344a3e00.jpg
97108935731924493,"Hand Carved 22-karat Giltwood ""titi"" Armchair By Marjorie Skouras",22-karat gold leaf. Hand carved wood armchair. The arms have carved hands and pointed toe heels at the feet. Designed by Marjorie Skouras.,a golden chair with a blue cushion on it's back legs and arms in the shape of a human hand,https://i.pinimg.com/736x/b4/33/8e/b4338ea40d41acea7920980e7db157a6.jpg
125889752073202632,Locus Solus Orange Chair by Gae Aulenti,"The perfect piece to add color and personality to a patio, garden or pool area, this chair of the Locus Solus Collection merges functional design with a unique aesthetic. Originally designed in 1964 by Italian architect Gae Aulenti and re-edited in 2016 by Exteta, the bright orange frame is composed of two steel rods, one forming front legs, armrests, and backrest in one continuous line, and the other creating the back legs. The round padded seat features a removable fabric cover printed with the exclusive Locus Solus artwork and is available also in all Exteta catalog fabric on request. If the products are placed completely outside, nightcovers that can be purchased at an extra price are recommended. Please contact the Concierge for further information and options.",two orange chairs sitting next to each other,https://i.pinimg.com/736x/50/d7/65/50d765d73e1c7cdf227f814cea173d8b.jpg
580260733272527459,Swing Chair Designed by Jean Pujol for Rue Interieure,"This little masterpiece is the result of the expert experiments with pipes. The brilliant combination of modern taste with the historical design, Swing mixes the rigidity of steel with the softness of the gentle bouncing movement. The characteristics of steel and the reversed cantilever generate a two-way movement. The leather rolled cushion supports your lumbar spine and relaxes your mind.",a chair that is sitting on the ground,https://i.pinimg.com/736x/58/25/36/5825362400b35fb1643b731e0984db66.jpg
48061921665215019,"Leisure Chair - TimberCraft Designs American style retro fabric lazy leisure chair pinkWood | 27.17"" H X 55.12"" W X 40.94"" D | …","Pumpkin shaped single sofa creative living room single casual European retro fabric lazy sofa TimberCraft Designs Fabric: Brown Polyester Blend | Leisure Chair - TimberCraft Designs American style retro fabric lazy leisure chair pinkWood / Polyester | 27.17"" H X 55.12"" W X 40.94"" D | Wayfair",a brown chair sitting on top of a white floor,https://i.pinimg.com/736x/cf/0b/8e/cf0b8ef726aefa541d465055f53bfaf2.jpg
