Pinterest ID,Name,Description,Alt Text,URL
49258189668376904,Judarn Delaney Chair,"Style No. 87207270; Color Code: 000 A structured, fully upholstered frame holds plump, cozy cushions for a statement-making piece worth sinking into. For ordering assistance and more, please contact us. For aesthetic advice and tips to help decorate your space, enjoy our complimentary home styling services. Velvet upholstery: 100% polyester Back cushion: 70% conjugate fiber, 30% feathers/down Seat cushion: Inner core consists of a 2.0 density HR foam with a soft foam wrap; the core is encased in a premium down-proof fabric and filled with a blend of 70% conjugate fiber, 30% feathers/down Webbed seat construction Kiln-dried hardwood frame One seat and one back cushion Cushions are removable and reversible for fabric Professionally clean; cleaning code S This piece is intended for indoor use No assembly required USA",an upholstered chair with blue flowers on it,https://i.pinimg.com/736x/fb/4c/8b/fb4c8b5f0dd039fc127111be37dfe887.jpg
97108935735143522,Sedia Tonda Armchair By Edoardo Lietti Studio,"Sedia Tonda Armchair by Edoardo Lietti Studio Unique Piece Dimensions: D 42 x W 55 x H 75 cm. Materials: Birch plywood. Weight: 12 kg. The chair is a flatpack that can be easily assembled and disassembled. The object came with an authenticity tag and assembly instructions, no tools are required. Please contact us. All objects are self-manufactured, making each a unique piece of contemporary design. Made through a thoughtful production, working with honest materials, finished with oil stained wit",a chair made out of wood with a red back and seat on it's side,https://i.pinimg.com/736x/cf/56/de/cf56dedb880f5fb43dc334973d6f6a93.jpg
67976275711188990,Lounge Chair,Sleek contemporary lounge chair in metal and plywood. Soft bouclé fabric gives the chair an inviting look. Height 27 1/4 in. Depth 30 in. Width 38 1/2 in. Supplied partially assembled.,"a white chair with a light colored upholstered back and arms, sitting in front of a white background",https://i.pinimg.com/736x/4e/cf/4c/4ecf4cc69e785654468af783f56bc37e.jpg
289848926036070645,"Lozano Accent Chair, Ivory","The Lozano accent chair offers a low-profile design with fresh appeal. This armless occasional chair lends an organic feel with clean parchment upholstery, relaxed cushions, and natural oak rounded legs adding a chunky look.","a living room with a chair, table and rug on the floor in front of a window",https://i.pinimg.com/736x/fd/b5/53/fdb553c8c4c81c3ffffab0169d211f44.jpg
143130094401317561,Bell Chair by Studio Sam Klemick [Custom Order],"Bell Chair by Studio Sam Klemick Available in custom upholstery and stain options. Please email sales@claudehome.com for further information. Materials: bleached oak, canvas - custom finish + upholstery available Measurements: 29.5” H x 28.5” D x 28” W Seat Height: 15.5” Price with cushion: $5,400 Price without cushion: $5,700 Item is made to order Estimated production time: 3-4 weeks after fabric is received. Shipping not included in price, please email Sales@claudehome.com for a quote",a chair that is sitting on some kind of wood with a black and red cushion,https://i.pinimg.com/736x/00/12/6b/00126b071fcc215d8f75fdfaab416c20.jpg
146718900354160416,"Surrealist Sustainable Figurative Titi Club Chair by Marjorie Skouras, Gold Finish","The Titi Chair is one of Marjorie's most iconic designs, which has been a best seller since its debut in 2009. She has graced the homes of fans from all over the United States, Europe, Australia and Mexico to date, and has been featured in shelter publications around the world. Some of her fans have sent their own favorite nail polish color to Marjorie for her manicure. You can too, please inquire. Each Titi chair is hand carved in Marjorie's studio in Merida, Mexico by an expert Ebanista. She is then hand painted in the studio in a bright gold metallic acrylic paint, and finished with a transparent sealer for protection. We are happy to accommodate special color requests as well. Each piece is made to order, so we very much appreciate your patience while we create this piece of art for you.",a gold colored chair with a woman's legs sticking out from the back and arms,https://i.pinimg.com/736x/f7/d5/75/f7d5755d20b89e7a11c996c8428d7b01.jpg
1019502434394582720,Theia Lounge Chair,"The Theia lounge chair is a true embodiment of elegance and sophistication. Crafted with precision and care, this exquisite piece is named after the Greek mythological goddess who gave birth to the moon goddess, Selene. The chair's design is inspired by the celestial world, with its two curving armrests and a wide, hand-carved back leg featuring a natural chisel texture. Handmade in the designer's Brooklyn studio Locally sourced woods Each piece is unique Elevate your space with this one-of-a-kind lounge chair that exudes refinement and luxury.",a red chair sitting on top of a white floor next to a light that is turned on,https://i.pinimg.com/736x/e6/61/0a/e6610a17488eaabfbf8354b4c8f7b92e.jpg
319614904823841773,Aria Accent Chair,,a white chair sitting on top of a hard wood floor next to a table and lamp,https://i.pinimg.com/736x/56/a5/58/56a5588612df55bcf5ca1d2c41ae02ec.jpg
401313016817419084,UPHOLSTERED BOUCLÉ ARMCHAIR | Zara Home United States of America,"Upholstered armchair in bouclé fabric with contrast wooden sides and legs. Includes adjustable buffers at the bottom of each leg, designed to maintain stability and prevent the legs from scratching the floor. Distance from the seat to the floor: 16.5\"""" }, { ""@context"": ""http://schema.org/",a white chair sitting on top of a hard wood floor next to a brown wall,https://i.pinimg.com/736x/62/58/81/625881b3d52a95e3603fd1ef85cc260d.jpg
97108935732851683,1980s German Abstract Design Upholstered Iron Tall Back Chair,,a chair that is sitting in front of a starfish sculpture on a white background,https://i.pinimg.com/736x/2b/e5/cf/2be5cf7bc60a94f2a6553d43479ef21a.jpg
79868593386679397,Dexter Lounge Chair,"Midcentury modern gets the luxe treatment in the form of the Dexter Lounge Chair thanks to its unique silhouette, tonal leather detailing, autumn brown wood frame and fawn cashmere upholstery.",a chair with wooden legs and a beige upholstered cushion on the armrests,https://i.pinimg.com/736x/d0/60/0c/d0600c9ee708e864ab94ccb10dc93c31.jpg
289848926036070639,"Kya Accent Chair, Ivory Basket Boucle","Our Kya accent chair brings a laid-back touch to modern design. Its streamlined silhouette is upholstered in textural bouclé, trimly tailored for comfort. Pair this chair with a chic side table and statement lamp for an artful take on a reading nook.",a white chair sitting in front of a vase filled with flowers on top of a hard wood floor,https://i.pinimg.com/736x/81/33/c0/8133c09635749cb6a3f059023eaa953b.jpg
68746207701,MINNA x LikeMindedObjects CRCL Chair - Honey & Hibiscus | MINNA,"Together MINNA & LMO present the CRCL Chair, a classic LMO design now available in handwoven MINNA fabrics. Sustainably designed, each chair is handmade using recycled paper, regional pine, and utilizes alternative cushion stuffing consisting of recycled fast fashion textile waste, instead of commonly used petroleum based foams. Made to order, the chair can be customized with your favorite MINNA textile and the design can be adjusted into a loveseat or daybed with custom pricing. Email trade@minna-goods.com for customization.",a striped chair sitting on top of a white floor,https://i.pinimg.com/736x/0d/41/01/0d4101b713dfd0f3794dfd061f83995b.jpg
358458451599019287,Izzy Petite Accent Chair,"Style No. 57867764; Color Code: 030 More than just an accent, this petite respite sets the tone for the entire room with a classic-meets-modern silhouette and vibrant upholstery. For ordering assistance and more, please contact us. For aesthetic advice and tips to help decorate your space, enjoy our complimentary home styling services. Cotton-Linen upholstery: 60% linen, 40% cotton Cushion content: Foam & fiber Spring seat construction Tropical hardwood frame; acacia wood legs Iron hardware accents Mortise and tenon joinery Professionally clean This piece is intended for indoor use Some assembly required Imported","an upholstered chair with colorful flowers and birds painted on the back, sitting in front of a pink wall",https://i.pinimg.com/736x/25/08/02/25080238ee109315487b358aea491369.jpg
300052393939903480,The Rody Dining Side Chair - COM / COL,"The Rody Dining Side Chair is made to order. Available in a large variety of fabrics, genuine leathers, hides & also offered in COM & COL. Other wood frames and metal hardware finishes also available upon request. Shown in: Natural walnut solid wood frame and COM & COL Designed, developed and handcrafted in Toronto, Canada by YJ Interiors W: 19"" D: 19"" H: 32"" SH: 19""",a wooden chair with a leather seat and arm rest,https://i.pinimg.com/736x/8b/73/bf/8b73bf1d0893e224945821dcd547875a.jpg
4611404640932519936,Nordic Model House Color Horseshoe Chair Internet Celebrity Single Elephant Leg Chair Living Room,Nordic Model House Color Horseshoe Chair Internet Celebrity Single Elephant Leg Chair Living Room,a white bench sitting on top of a wooden deck,https://i.pinimg.com/736x/9f/df/78/9fdf7885edadbcd3be883dc24758a6d5.jpg
101190322927757431,Outopee 2 Casual Brown Corduroy Accent Chair | LO1G98000163,"Enhance your living space with our Luxe Corduroy Accent Chair with Wooden Armrests, High Resilience Foam, Comfortable Lumbar Pillow, Humanized Angle of Backrest and Curve of Armrests, Mid-century Charm, the perfect combination of comfort and style.. Sink into the high-resilience cushions, which retain shape and comfort even after prolonged use.. Corduroy fabric is easy to clean and maintain, also has good abrasion resistance.. Outopee 2 Casual Brown Corduroy Accent Chair | LO1G98000163","Enhance your living space with our Luxe Corduroy Accent Chair with Wooden Armrests, High Resilience Foam, Comfortable Lumbar Pillow, Humanized Angle of Backrest and Curve of Armrests, Mid-century Charm, the perfect combination of comfort and style.. Sink into the high-resilience cushions, which retain shape and comfort even after prolonged use.. Corduroy fabric is easy to clean and maintain, also has good abrasion resistance.. Outopee 2 Casual Brown Corduroy Accent Chair | LO1G98000163",https://i.pinimg.com/736x/9e/71/a5/9e71a5996d229bc659043c7595ce7995.jpg
283515739034960519,Bliss Chair,,a wooden chair sitting next to a stack of books on top of a white table,https://i.pinimg.com/736x/b9/4a/70/b94a7044b4ec2a2246fd3db2564f3d1a.jpg
79446380923066738,Hotel Le Malandre Tulip Chairs and Table,"A concept store, bar, and event space in Tribeca, New York. Shop the full In Common With lighting collection alongside vintage furniture, décor, books, pantry items, gifts, and works by peers and fellow artists. Store: Tuesday–Saturday, 11am–6pm. Café: Tuesday–Saturday, 11am–4pm. Bar: Thursday–Saturday, 4pm–12am.",Quarters | Hotel Le Malandre Tulip Chairs and Table,https://i.pinimg.com/736x/3e/25/33/3e25338d4841e569243231389fa88795.jpg
321374123427478120,This French Designer is Bringing the Collectible Design Gallery Model to India - Sight Unseen,"“Everyone has their eyes on India,” says French designer Florence Louisy, who ended up in the country herself quite serendipitously but has since carved a path. As co-founder and creative director of the Mumbai gallery Aequo (Æquō) — self-described as “India’s first collectible design gallery” — Louisy encourages international designers to discover and adapt traditional craft techniques from across the country, and to collaborate with artisans to create collections of beautiful contemporary…",a metal chair sitting on top of a white floor,https://i.pinimg.com/736x/a3/01/55/a301552407e200cf849a6135d926be36.jpg
558446422563693882,"Soho Home Vivienne Armchair, Velvet, Rust, Us | White","An extension of our Vivienne range, this swivel armchair takes its inspiration from the 1960s-inspired interiors of White City House. Upholstered in a cotton velvet fabric, pleated stitch detailing to the back of the chair makes it a versatile piece to sit in any area of the living room while adding a tactile point of interest. The oversized curved shape is an elevated take on the classic tub armchair, created for cozy, conversational moments in mind. Soho Home Vivienne Armchair, Velvet, Rust, U",an orange chair sitting on top of a wooden floor,https://i.pinimg.com/736x/6b/c3/dc/6bc3dc54901132de1e9ddf63e54eec10.jpg
132011832822792604,"Pair of Brasiliana Armchairs by Jorge Zalszupin, 1965, Brazilian Midcentury","The iconic Brasiliana is a series composed of a sofa and armchair designed by Jorge Zalszupin (1922-2020) in 1965 and produced by his company, L'atelier. These rare pieces have molded laminate wood structures and were part of the first line of furniture from L’atelier. Designed for the launch of the store, this collection still had the execution and details of artisanal woodwork but already introduced some techniques and materials considered innovative. Brasiliana armchairs and sofa take advantage of molded laminate to create a light structure that elegantly comfortable cushions. The pieces are composed of rectangular plywood boards with curved ends, assembled together by small metal parts and the well-known brass cross-head screws characteristic of L’atelier. Much more than rationalizing design, Zalszupin focused mainly on the acquisition and use of new technologies and materials to make series production viable. Oswaldo Mellone, an architect and designer who worked as Zalszupin's assistant, said the Brasiliana series is inspired by the architecture of the palaces and buildings designed by Oscar Niemeyer for the country's new capital, Brasília. In fact, the armchair legs are very similar to the columns of the Federal Supreme Court, built between 1958 and 1960. These Brasiliana armchairs are in very good vintage condition and have the original upholstery. Wood restoration and upholstery service by our Workshop are included.",a brown chair sitting on top of a white floor,https://i.pinimg.com/736x/d4/48/53/d448534a8f970bec5ff6138de269c9f1.jpg
280138039314611593,Ultima Solid Oakwood Designer Chair,"Bring Your Home Environment To Life With A Splendid Display Of Style & Functionality Have you ever had the pleasure of owning something visually stunning and artistic? Our Ultima Solid Oakwood Designer Chair is exactly that and more. Hand-finished by world-class artisans and craftsmen, this exquisite masterpiece is a true testament to the finest craftsmanship that will bring your home decoration game to a whole new level. Perfect as a gift for art lovers, new house opening, birthday gifts, home decor, etc. Product Details: Estimated Production Time: 7 days Estimated Delivery Time: 25-30 days Customization: Please contact us for available color swatches Total Height: 61cm Seat Height: 38cm Base Width: 51cm Back Width: 60cm Material: Oakwood Frame & Cotton + Linen fabric Feature: High Grade and 100% brand new & hand-finished Package: High-Quality Carton Box + Padded foam Note: 1. Please allow 0-1 cm measurement error due to manual carving and crafting. 2. It’s a handmade product. There might be a slight bump on the surface and a little out of the lines coloring. Package Includes: 1 x High-Quality Ultima Solid Oakwood Designer Chair",a chair and ottoman sitting next to each other,https://i.pinimg.com/736x/a3/cb/22/a3cb228f8c86e16111e3a77d67fef084.jpg
4611615728647190528,"Clam Chair by Arnold Madsen, Chairs","An updated version of a truly iconic design, the modern Clam Chair is a striking homage to Danish Modern design, delivering sleek simplicity and rich character. Plush sheepskin upholstery pairs with beautiful, smooth wood framing, creating an indulgent look and feel that elevates both style and comfort to new heights in your home. Features: Tufting adds texture and depth to the vintage aesthetics of a modern accent chair Plush sheepskin upholstery pairs with wood arms and legs for a compelling textural blend Crafted using traditional joinery and modern technology for the perfect blend of classic and contemporary Named for a silhouette that evokes an open clamshell Designed by Danish upholsterer Arnold Madsen in Copenhagen, circa 1944 Crafted by European design studio, Dagmar. Materials: Solid Beech Wood, Genuine Sheepskin Measurements: Dimensions (in): 25.6W x 31.5D x 32.3H Dimensions (cm): 65W x 80D x 82H Seat Height (in): 16.5H Seat Height (cm): 42 Shipping info: Production Lead Time: 12-14 weeks",the chair is made out of sheep's wool and has a wooden armrest,https://i.pinimg.com/736x/1e/57/39/1e573949a4186997eb117f30ae79c1df.jpg
4610982461055412224,Corduroy Corduroy Fabric Accent Chair,"Enhance the visual appeal of your living space with the exquisite ""Corduroy Fabric Accent Chair"". This distinct piece is upholstered in a luxurious soft beige corduroy fabric that feels plush...",the chair is made out of wood and has an unusual shaped armrest on it,https://i.pinimg.com/736x/07/d9/e5/07d9e53119f53638dc2107e0b11856d1.jpg
351914158400182769,julegaveønsker | cille,"Jeg lyver ikke når jeg siger, at ønskelisten ikke bugner af ting i år, mest af alt fordi de fleste af mine ønsker ikke kan findes her på den...",a century of danish chairs with pictures of different types of chairs and their names on them,https://i.pinimg.com/736x/e2/36/b8/e236b82625f41e1a4c597ee20e29eaf8.jpg
442619469671440662,Embrace Gentle 753 Armchair by Royal Stranger,"Embrace Gentle 753 Armchair by Royal Stranger Dimensions: W 96 x D 85 x H 68 cm. Materials: Upholstery. Featuring an enfolding composition of geometrical shapes, the Embrace Armchair will cozy you up in a nest-like chair. Its back rounded silhouette allied to a very smooth seat raises the perfect setting to fall asleep after a movie night. Its tiny dimension yet outstanding gives you the feeling of a warm embrace in all the right places. This smooth Armchair reflects both an obsession with comf",a blue chair sitting on top of a white floor,https://i.pinimg.com/736x/85/66/7c/85667c1b6a20e37e173fc9f466c167e9.jpg
24277285506021380,Kian Chenille Accent Chair,"This accent piece has a deep seat you can sink into, providing a comfy and eye-catching addition to any room. For ordering assistance and more, please contact us For aesthetic advice and tips to help decorate your space, enjoy our complimentary home styling services | Kian Chenille Accent Chair by Anthropologie in Blue, Polyester/Cotton/Acrylic","This accent piece has a deep seat you can sink into, providing a comfy and eye-catching addition to any room. For ordering assistance and more, please contact us For aesthetic advice and tips to help decorate your space, enjoy our complimentary home styling services | Kian Chenille Accent Chair by Anthropologie in Blue, Polyester/Cotton/Acrylic",https://i.pinimg.com/736x/b4/e8/4b/b4e84b97feee5c92eb5ed2fad7c3acce.jpg
259801472270204023,Bubble Statement Chair in White at Urban Outfitters,"Modern influences blend with playful silhouettes to create this statement chair that lends the coziest feel to your reading nooks. Upholstered in textural polyester fabrics, this chair features curving lines allover for a soft touch. Low-slung silhouette sets on four short cylindrical-shaped legs. This custom piece of furniture will be made to order just for you. Available exclusively at Urban Outfitters. Features Statement chair from UO Home Upholstered in textural polyester Low-slung silhouett",a white chair sitting on top of a floor next to a potted plant in a living room,https://i.pinimg.com/736x/be/b2/84/beb2848cbd8a7204f0d6338132185c0c.jpg
146296687890028962,Rey Chair Upholstered - Fall Green Lacquered Beech / Steelcut Trio 916,"Based on the original Rey Collection designed by Swiss designer Bruno Rey in 1971, HAY has teamed up with Dietiker to relaunch the Rey Chair. With its distinctively rounded edges and curved backrest, it was the first chair to be patented with Dietiker's unique 'screwless' wood-to-metal connection and has become one of the most successful Swiss chairs of all time. For the upholstered version of this chair HAY has selected complimentary colours from Kvadrat's Steelcut Trio fabric collection. Steel",a red chair sitting on top of a floor next to a white wall with a shadow cast on it,https://i.pinimg.com/736x/77/c0/24/77c0243880432b8bd41ce7a97fbadcd5.jpg
194358540168859054,Boa Sulfur Yellow Pouf,"The donut-shaped Boa Pouf by Sabine Marcelis is perfectly sculptural; a bold graphic form that interrupts interior landscapes with its faultless chunky geometry. This piece of upholstered occasional furniture is rounded and soft, encased in a seamless outer layer that gives it an air-brushed finish: The smooth shape-knit textile that covers the Boa Pouf is a milestone in technologically innovative furniture making. Boa Pouf is as perfect for perching on, propping up feet, lounging against, as it",three different colored donuts sitting next to each other on the floor in front of a window,https://i.pinimg.com/736x/85/80/07/8580078a4d4a331e76559fd79fb487f6.jpg
97108935742548381,'barcelona' Chair,"A 'Barcelona' chair, with brown leather upholstery and belting straps on a chromed steel frame.??",a brown leather chair sitting on top of a metal frame,https://i.pinimg.com/736x/58/f1/ce/58f1ceae17fb673910646036f1920d4c.jpg
8022105580917664,Emerson Office Chair,"Embrace mid-century modern elegance with this office chair adorned in a dusty blue velvet corduroy upholstery. The button detailing adds a touch of sophistication, complemented by the brushed gold arms, base, and caster wheels. The chair offers comfort with a tall back, padded armrests, and a 360 swivel seat for ease of movement. Mid-century modern design Soft velvet corduroy fabric Padded armrests 5-spoke brushed gold base Gold-accented caster wheels 360 swivel Assembly required",a blue office chair sitting on top of a rug,https://i.pinimg.com/736x/9a/a0/ea/9aa0ea55ca86b23d71c5dc6ac34091a2.jpg
63965257210134273,"Desmond Chair, Deluxe Velvet, Golden Oak, Polished Stainless Steel","KEY DETAILS Kiln-dried solid wood interior frame. Metal exterior frame. Webbed seat cushion support. Polyester fiber filled cushions. Seat cushion attaches to frame with velcro straps. GREENGUARD Gold Certified. This low-emitting product has been screened for over 10,000 chemicals and VOCs. This contract-grade item is manufactured to meet the demands of commercial use in addition to residential. See more. Made in Vietnam.",a chair that is sitting in the middle of a white floor with a tan cushion on it,https://i.pinimg.com/736x/c4/94/1f/c4941f65e47eb7832dff632755617b5a.jpg
24840235439120026,"Wilson Walnut Chair - Roped Back, Chairs","Rope wrapping creates exceptional texture and dimension for the tapering back of a modern accent chair. Crafted from walnut using tenon and mortise techniques, the chair creates a custom effect in your space, offering a compelling blend of sculptural, architectural, and artisan design influences. Features: Round plank seat pairs with a sculptural seat back to create a true art piece Corded back create a sense of texture and artistic lightness Features oiled and waxed European walnut wood construction Assembled by tenon and mortise Designed by skilled architect, designer and woodworker Eloi Schultz, based in Paris, France Measurements: Dimensions (cm): 84 x 60 x 44  Seat Height (cm): 30 cm Dimensions (in): 33"" x 24"" x 17"" Seat Height (in): 11.8"" Shipping info: Production Lead Time: 6-8 weeks Customizations are available upon request. Shipping fees will be invoiced separately and are not included in the listed price. To obtain a quote, kindly contact sales@claudehome.com via email.",a wooden chair sitting on top of a wooden bench next to a white wall and floor,https://i.pinimg.com/736x/76/cf/73/76cf735d4c1b8fe267789f86bb40ce6b.jpg
88946161386021793,Him Chair by Casamania - 1,"The Him Chair by Casamania, designed by Fabio Novembre, is a striking piece of furniture that blends art and functionality. Inspired by the iconic Panton Chair, the Him Chair is crafted from rotationally molded polyethylene, making it suitable for both indoor and outdoor use. This Him Chair is characterized by its anthropomorphic design, derived from the three-dimensional scanning of a male plaster sculpture. The result is a chair that mimics the form of a naked male body, creating a bold and pr",an outdoor dining area with white furniture and bamboo trees in the backgrouds,https://i.pinimg.com/736x/9b/fa/4d/9bfa4d71e367ecaf361febdf86221ca7.jpg
2674081024914736,Midcentury Modern Contemporary,,a brown leather chair sitting on top of a wooden base,https://i.pinimg.com/736x/e2/78/cb/e278cbecc5d9e9a15308eaf8e8281d61.jpg
300896818873493530,Martinique Velvet Swivel Chair,"Style No. 87106829; Color Code: 516 Defined by soft curved lines and upholstered in even softer velvet, the Martinique chair offers a reimagined spin on the classic accent seat. For ordering assistance and more, please contact us. For aesthetic advice and tips to help decorate your space, enjoy our complimentary home styling services. Velvet upholstery: 100% polyester Cushion content: Foam & fiber fill Spring seat construction Swivel mechanism Poplar, gum wood frame Professionally clean This piece is intended for indoor use No assembly required Imported",a purple chair sitting on top of a white floor,https://i.pinimg.com/736x/c9/f0/85/c9f0859547d437918548e37c4d301d3d.jpg
